{
  "$schema": "../schemas/stage.schema.json",
  "id": "debug-battle",
  "background_path": "src/data/assets/BattleStage01.png",
  "image_area": {
    "x": 0,
    "y": 0,
    "w": 1536,
    "h": 1024
  },
  "width": 8,
  "height": 8,
  "terrain": [
    ["floor", "floor", "floor", "floor", "floor", "floor", "floor", "floor"],
    ["floor", "floor", "floor", "floor", "floor", "floor", "floor", "floor"],
    ["floor", "floor", "floor", "floor", "floor", "floor", "floor", "floor"],
    ["floor", "floor", "hazard", "floor", "floor", "floor", "floor", "floor"],
    ["floor", "floor", "floor", "floor", "wall", "floor", "floor", "floor"],
    ["floor", "floor", "floor", "floor", "floor", "floor", "floor", "floor"],
    ["floor", "floor", "floor", "floor", "floor", "floor", "floor", "floor"],
    ["floor", "floor", "floor", "floor", "floor", "floor", "floor", "floor"]
  ],
  "units": [
    { "unitId": "ally-left", "x": 1, "y": 3 },
    { "unitId": "ally-right", "x": 4, "y": 3 },
    { "unitId": "enemy-mid", "x": 3, "y": 3 },
    { "unitId": "enemy-top", "x": 5, "y": 1 }
  ]
}
